[
  {
    "atlas_id": "CPA-CAN-0032",
    "canonical_name": "cannabigerolic acid",
    "short_label": "(E)-CBGA-C5",
    "family": "CBG",
    "render_status": "PUBCHEM_3D_SDF_VERIFIED_PRESENT",
    "structure_source": {
      "provider": "PubChem",
      "pubchem_cid": 6449999,
      "record_url": "https://pubchem.ncbi.nlm.nih.gov/compound/6449999",
      "conformer_url": "https://pubchem.ncbi.nlm.nih.gov/rest/pug/compound/cid/6449999/record/SDF?record_type=3d",
      "retrieved_date": "2026-09-23"
    },
    "identifiers": {
      "molecular_formula": "C22H32O4",
      "molecular_weight": "360.5",
      "isomeric_smiles": "CCCCCC1=CC(=C(C(=C1C(=O)O)O)C/C=C(\\C)/CCC=C(C)C)O",
      "connectivity_smiles": "CCCCCC1=CC(=C(C(=C1C(=O)O)O)CC=C(C)CCC=C(C)C)O",
      "inchi": "InChI=1S/C22H32O4/c1-5-6-7-11-17-14-19(23)18(21(24)20(17)22(25)26)13-12-16(4)10-8-9-15(2)3/h9,12,14,23-24H,5-8,10-11,13H2,1-4H3,(H,25,26)/b16-12+",
      "inchikey": "SEEZIOZEUUMJME-FOWTUZBSSA-N"
    },
    "conformer": {
      "format": "SDF_V2000_3D",
      "path": "conformers/cbga.sdf",
      "atom_count": 58,
      "bond_count": 58,
      "includes_explicit_hydrogens": true
    },
    "governance_note": "Renderable structure provenance is independent of occurrence, biosynthesis, bioactivity, human effect, and safety evidence."
  },
  {
    "atlas_id": "CPA-CAN-0002",
    "canonical_name": "(−)-Δ9-trans-tetrahydrocannabinolic acid A",
    "short_label": "Δ9-THCAA-C5",
    "family": "THC",
    "render_status": "PUBCHEM_3D_SDF_VERIFIED_PRESENT",
    "structure_source": {
      "provider": "PubChem",
      "pubchem_cid": 98523,
      "record_url": "https://pubchem.ncbi.nlm.nih.gov/compound/98523",
      "conformer_url": "https://pubchem.ncbi.nlm.nih.gov/rest/pug/compound/cid/98523/record/SDF?record_type=3d",
      "retrieved_date": "2026-09-23"
    },
    "identifiers": {
      "molecular_formula": "C22H30O4",
      "molecular_weight": "358.5",
      "isomeric_smiles": "CCCCCC1=CC2=C([C@@H]3C=C(CC[C@H]3C(O2)(C)C)C)C(=C1C(=O)O)O",
      "connectivity_smiles": "CCCCCC1=CC2=C(C3C=C(CCC3C(O2)(C)C)C)C(=C1C(=O)O)O",
      "inchi": "InChI=1S/C22H30O4/c1-5-6-7-8-14-12-17-19(20(23)18(14)21(24)25)15-11-13(2)9-10-16(15)22(3,4)26-17/h11-12,15-16,23H,5-10H2,1-4H3,(H,24,25)/t15-,16-/m1/s1",
      "inchikey": "UCONUSSAWGCZMV-HZPDHXFCSA-N"
    },
    "conformer": {
      "format": "SDF_V2000_3D",
      "path": "conformers/thca-a.sdf",
      "atom_count": 56,
      "bond_count": 58,
      "includes_explicit_hydrogens": true
    },
    "governance_note": "Renderable structure provenance is independent of occurrence, biosynthesis, bioactivity, human effect, and safety evidence."
  },
  {
    "atlas_id": "CPA-CAN-0001",
    "canonical_name": "(−)-Δ9-trans-tetrahydrocannabinol",
    "short_label": "Δ9-THC-C5",
    "family": "THC",
    "render_status": "PUBCHEM_3D_SDF_VERIFIED_PRESENT",
    "structure_source": {
      "provider": "PubChem",
      "pubchem_cid": 16078,
      "record_url": "https://pubchem.ncbi.nlm.nih.gov/compound/16078",
      "conformer_url": "https://pubchem.ncbi.nlm.nih.gov/rest/pug/compound/cid/16078/record/SDF?record_type=3d",
      "retrieved_date": "2026-09-23"
    },
    "identifiers": {
      "molecular_formula": "C21H30O2",
      "molecular_weight": "314.5",
      "isomeric_smiles": "CCCCCC1=CC(=C2[C@@H]3C=C(CC[C@H]3C(OC2=C1)(C)C)C)O",
      "connectivity_smiles": "CCCCCC1=CC(=C2C3C=C(CCC3C(OC2=C1)(C)C)C)O",
      "inchi": "InChI=1S/C21H30O2/c1-5-6-7-8-15-12-18(22)20-16-11-14(2)9-10-17(16)21(3,4)23-19(20)13-15/h11-13,16-17,22H,5-10H2,1-4H3/t16-,17-/m1/s1",
      "inchikey": "CYQFCXCEBYINGO-IAGOWNOFSA-N"
    },
    "conformer": {
      "format": "SDF_V2000_3D",
      "path": "conformers/delta9-thc.sdf",
      "atom_count": 53,
      "bond_count": 55,
      "includes_explicit_hydrogens": true
    },
    "governance_note": "Renderable structure provenance is independent of occurrence, biosynthesis, bioactivity, human effect, and safety evidence."
  },
  {
    "atlas_id": "CPA-CAN-0047",
    "canonical_name": "cannabidiol",
    "short_label": "CBD-C5",
    "family": "CBD",
    "render_status": "PUBCHEM_3D_SDF_VERIFIED_PRESENT",
    "structure_source": {
      "provider": "PubChem",
      "pubchem_cid": 644019,
      "record_url": "https://pubchem.ncbi.nlm.nih.gov/compound/644019",
      "conformer_url": "https://pubchem.ncbi.nlm.nih.gov/rest/pug/compound/cid/644019/record/SDF?record_type=3d",
      "retrieved_date": "2026-09-23"
    },
    "identifiers": {
      "molecular_formula": "C21H30O2",
      "molecular_weight": "314.5",
      "isomeric_smiles": "CCCCCC1=CC(=C(C(=C1)O)[C@@H]2C=C(CC[C@H]2C(=C)C)C)O",
      "connectivity_smiles": "CCCCCC1=CC(=C(C(=C1)O)C2C=C(CCC2C(=C)C)C)O",
      "inchi": "InChI=1S/C21H30O2/c1-5-6-7-8-16-12-19(22)21(20(23)13-16)18-11-15(4)9-10-17(18)14(2)3/h11-13,17-18,22-23H,2,5-10H2,1,3-4H3/t17-,18+/m0/s1",
      "inchikey": "QHMBSVQNZZTUGM-ZWKOTPCHSA-N"
    },
    "conformer": {
      "format": "SDF_V2000_3D",
      "path": "conformers/cbd.sdf",
      "atom_count": 53,
      "bond_count": 54,
      "includes_explicit_hydrogens": true
    },
    "governance_note": "Renderable structure provenance is independent of occurrence, biosynthesis, bioactivity, human effect, and safety evidence."
  },
  {
    "atlas_id": "CPA-CAN-0048",
    "canonical_name": "cannabidiolic acid",
    "short_label": "CBDA-C5",
    "family": "CBD",
    "render_status": "PUBCHEM_3D_SDF_VERIFIED_PRESENT",
    "structure_source": {
      "provider": "PubChem",
      "pubchem_cid": 160570,
      "record_url": "https://pubchem.ncbi.nlm.nih.gov/compound/160570",
      "conformer_url": "https://pubchem.ncbi.nlm.nih.gov/rest/pug/compound/cid/160570/record/SDF?record_type=3d",
      "retrieved_date": "2026-09-23"
    },
    "identifiers": {
      "molecular_formula": "C22H30O4",
      "molecular_weight": "358.5",
      "isomeric_smiles": "CCCCCC1=CC(=C(C(=C1C(=O)O)O)[C@@H]2C=C(CC[C@H]2C(=C)C)C)O",
      "connectivity_smiles": "CCCCCC1=CC(=C(C(=C1C(=O)O)O)C2C=C(CCC2C(=C)C)C)O",
      "inchi": "InChI=1S/C22H30O4/c1-5-6-7-8-15-12-18(23)20(21(24)19(15)22(25)26)17-11-14(4)9-10-16(17)13(2)3/h11-12,16-17,23-24H,2,5-10H2,1,3-4H3,(H,25,26)/t16-,17+/m0/s1",
      "inchikey": "WVOLTBSCXRRQFR-DLBZAZTESA-N"
    },
    "conformer": {
      "format": "SDF_V2000_3D",
      "path": "conformers/cbda.sdf",
      "atom_count": 56,
      "bond_count": 57,
      "includes_explicit_hydrogens": true
    },
    "governance_note": "Renderable structure provenance is independent of occurrence, biosynthesis, bioactivity, human effect, and safety evidence."
  },
  {
    "atlas_id": "CPA-CAN-0031",
    "canonical_name": "cannabigerol",
    "short_label": "(E)-CBG-C5",
    "family": "CBG",
    "render_status": "PUBCHEM_3D_SDF_VERIFIED_PRESENT",
    "structure_source": {
      "provider": "PubChem",
      "pubchem_cid": 5315659,
      "record_url": "https://pubchem.ncbi.nlm.nih.gov/compound/5315659",
      "conformer_url": "https://pubchem.ncbi.nlm.nih.gov/rest/pug/compound/cid/5315659/record/SDF?record_type=3d",
      "retrieved_date": "2026-09-23"
    },
    "identifiers": {
      "molecular_formula": "C21H32O2",
      "molecular_weight": "316.5",
      "isomeric_smiles": "CCCCCC1=CC(=C(C(=C1)O)C/C=C(\\C)/CCC=C(C)C)O",
      "connectivity_smiles": "CCCCCC1=CC(=C(C(=C1)O)CC=C(C)CCC=C(C)C)O",
      "inchi": "InChI=1S/C21H32O2/c1-5-6-7-11-18-14-20(22)19(21(23)15-18)13-12-17(4)10-8-9-16(2)3/h9,12,14-15,22-23H,5-8,10-11,13H2,1-4H3/b17-12+",
      "inchikey": "QXACEHWTBCFNSA-SFQUDFHCSA-N"
    },
    "conformer": {
      "format": "SDF_V2000_3D",
      "path": "conformers/cbg.sdf",
      "atom_count": 55,
      "bond_count": 55,
      "includes_explicit_hydrogens": true
    },
    "governance_note": "Renderable structure provenance is independent of occurrence, biosynthesis, bioactivity, human effect, and safety evidence."
  },
  {
    "atlas_id": "CPA-CAN-0067",
    "canonical_name": "cannabichromene",
    "short_label": "CBC",
    "family": "CBC",
    "render_status": "PUBCHEM_3D_SDF_VERIFIED_PRESENT",
    "structure_source": {
      "provider": "PubChem",
      "pubchem_cid": 30219,
      "record_url": "https://pubchem.ncbi.nlm.nih.gov/compound/30219",
      "conformer_url": "https://pubchem.ncbi.nlm.nih.gov/rest/pug/compound/cid/30219/record/SDF?record_type=3d",
      "retrieved_date": "2026-09-23"
    },
    "identifiers": {
      "molecular_formula": "C21H30O2",
      "molecular_weight": "314.5",
      "isomeric_smiles": "CCCCCC1=CC(=C2C=CC(OC2=C1)(C)CCC=C(C)C)O",
      "connectivity_smiles": "CCCCCC1=CC(=C2C=CC(OC2=C1)(C)CCC=C(C)C)O",
      "inchi": "InChI=1S/C21H30O2/c1-5-6-7-10-17-14-19(22)18-11-13-21(4,23-20(18)15-17)12-8-9-16(2)3/h9,11,13-15,22H,5-8,10,12H2,1-4H3",
      "inchikey": "UVOLYTDXHDXWJU-UHFFFAOYSA-N"
    },
    "conformer": {
      "format": "SDF_V2000_3D",
      "path": "conformers/cbc.sdf",
      "atom_count": 53,
      "bond_count": 54,
      "includes_explicit_hydrogens": true
    },
    "governance_note": "Renderable structure provenance is independent of occurrence, biosynthesis, bioactivity, human effect, and safety evidence."
  },
  {
    "atlas_id": "CPA-CAN-0068",
    "canonical_name": "cannabichromenic acid",
    "short_label": "CBCA",
    "family": "CBC",
    "render_status": "PUBCHEM_3D_SDF_VERIFIED_PRESENT",
    "structure_source": {
      "provider": "PubChem",
      "pubchem_cid": 3084339,
      "record_url": "https://pubchem.ncbi.nlm.nih.gov/compound/3084339",
      "conformer_url": "https://pubchem.ncbi.nlm.nih.gov/rest/pug/compound/cid/3084339/record/SDF?record_type=3d",
      "retrieved_date": "2026-09-23"
    },
    "identifiers": {
      "molecular_formula": "C22H30O4",
      "molecular_weight": "358.5",
      "isomeric_smiles": "CCCCCC1=CC2=C(C=CC(O2)(C)CCC=C(C)C)C(=C1C(=O)O)O",
      "connectivity_smiles": "CCCCCC1=CC2=C(C=CC(O2)(C)CCC=C(C)C)C(=C1C(=O)O)O",